{
  "schema_version": 1,
  "id": "nla_d40e6af3490fa2d2236f88c3c1777eae",
  "title": "Seishun Otoko",
  "snapshot": {},
  "blob": {
    "sha256": "12a93181319520b07fa4d37da4caaae88390f97433dabd0e8d953a97ee09c298",
    "path": "levels/sha256/12/12a93181319520b07fa4d37da4caaae88390f97433dabd0e8d953a97ee09c298.rbxlx",
    "format": "xml",
    "size_bytes": 18231560,
    "download_url": "https://raw.githubusercontent.com/Builder-Pals/native-level-archive/main/levels/sha256/12/12a93181319520b07fa4d37da4caaae88390f97433dabd0e8d953a97ee09c298.rbxlx"
  },
  "validation": {
    "status": "valid"
  },
  "provenance": {
    "original_paths": [
      "Seishun Otoko.rbxl"
    ],
    "collection": "root"
  },
  "discovery": {},
  "match": {
    "status": "unresolved",
    "confidence": "none",
    "reviewed": false
  },
  "preferred": false
}
