{
  "schema_version": 1,
  "id": "nla_d58c9829cca79208d16a979a29ecd2a0",
  "title": "can u escape the killer barneys",
  "snapshot": {},
  "blob": {
    "sha256": "ba63767d29ffa345a674a706c678fbd4fdef2130d3dc4b1d7b976e007d7992ab",
    "path": "levels/sha256/ba/ba63767d29ffa345a674a706c678fbd4fdef2130d3dc4b1d7b976e007d7992ab.rbxlx",
    "format": "xml",
    "size_bytes": 3435341,
    "download_url": "https://raw.githubusercontent.com/Builder-Pals/native-level-archive/main/levels/sha256/ba/ba63767d29ffa345a674a706c678fbd4fdef2130d3dc4b1d7b976e007d7992ab.rbxlx"
  },
  "validation": {
    "status": "valid"
  },
  "provenance": {
    "original_paths": [
      "can u escape the killer barneys.rbxl"
    ],
    "collection": "root"
  },
  "discovery": {},
  "match": {
    "status": "unresolved",
    "confidence": "none",
    "reviewed": false
  },
  "preferred": false
}
