{
  "schema_version": 1,
  "id": "nla_50e5cf4b222398704c9c4a2753de76d3",
  "title": "millons of Roblox. Kill them",
  "snapshot": {},
  "blob": {
    "sha256": "d1d406ed39a88ed810f17a93dee9e2296dc79df2a9cba527633e62dc94222ad5",
    "path": "levels/sha256/d1/d1d406ed39a88ed810f17a93dee9e2296dc79df2a9cba527633e62dc94222ad5.rbxlx",
    "format": "xml",
    "size_bytes": 9240300,
    "download_url": "https://raw.githubusercontent.com/Builder-Pals/native-level-archive/main/levels/sha256/d1/d1d406ed39a88ed810f17a93dee9e2296dc79df2a9cba527633e62dc94222ad5.rbxlx"
  },
  "validation": {
    "status": "valid"
  },
  "provenance": {
    "original_paths": [
      "millons of Roblox. Kill them.rbxl"
    ],
    "collection": "root"
  },
  "discovery": {},
  "match": {
    "status": "unresolved",
    "confidence": "none",
    "reviewed": false
  },
  "preferred": false
}
