{
  "schema_version": 1,
  "id": "nla_df7a26487860730e0d0b35270dc84e9b",
  "title": "Lando's Apartment (2010, stolen in-game)",
  "snapshot": {
    "label": "2010, stolen in-game",
    "date": "2010-01-01",
    "precision": "year"
  },
  "blob": {
    "sha256": "bd2e5b1fe70bbb9df02c36ff79db80452fd95c59ffc6862eed617c7619f44318",
    "path": "levels/sha256/bd/bd2e5b1fe70bbb9df02c36ff79db80452fd95c59ffc6862eed617c7619f44318.rbxlx",
    "format": "xml",
    "size_bytes": 12719610,
    "download_url": "https://raw.githubusercontent.com/Builder-Pals/native-level-archive/main/levels/sha256/bd/bd2e5b1fe70bbb9df02c36ff79db80452fd95c59ffc6862eed617c7619f44318.rbxlx"
  },
  "validation": {
    "status": "valid"
  },
  "provenance": {
    "original_paths": [
      "Lando's Apartment (2010, stolen in-game).rbxl"
    ],
    "collection": "root",
    "legacy_metadata_path": "Lando's Apartment (2010, stolen in-game).meta.json",
    "legacy_creator": "lando64000"
  },
  "badges": [
    {
      "id": 42549407,
      "name": "Lando's Plans",
      "origin": "legacy_sidecar"
    }
  ],
  "discovery": {
    "badge_ids": [
      42549407
    ]
  },
  "source": {
    "root_place_id": 33719689,
    "universe_id": 14236443,
    "name": "Lando's Apartment ",
    "roblox_url": "https://www.roblox.com/games/33719689",
    "description": "My mansion was haunted so I decided to move to this apartment in the city. I am the original creator of this map.",
    "creator": {
      "id": 1123551,
      "name": "lando64000",
      "type": "User"
    },
    "created_at": "2010-08-25T17:54:38.337Z",
    "updated_at": "2016-01-22T01:00:28.003Z"
  },
  "match": {
    "status": "verified",
    "confidence": "high",
    "reviewed": false,
    "evidence": [
      {
        "kind": "badge",
        "value": "42549407",
        "detail": "badge resolves to universe 14236443 and root place 33719689"
      }
    ]
  },
  "preferred": false
}
