{
  "schema_version": 1,
  "id": "nla_d9a870adaf0c4a1e616a97d6ebde10ee",
  "title": "Crossroads (Feb 2007)",
  "snapshot": {
    "label": "Feb 2007",
    "date": "2007-01-01",
    "precision": "year"
  },
  "blob": {
    "sha256": "971712306ef44c6550f399849fff1aee663d63be942db9a4d262b4e822f1b420",
    "path": "levels/sha256/97/971712306ef44c6550f399849fff1aee663d63be942db9a4d262b4e822f1b420.rbxlx",
    "format": "xml",
    "size_bytes": 4049455,
    "download_url": "https://raw.githubusercontent.com/Builder-Pals/native-level-archive/main/levels/sha256/97/971712306ef44c6550f399849fff1aee663d63be942db9a4d262b4e822f1b420.rbxlx"
  },
  "validation": {
    "status": "valid"
  },
  "provenance": {
    "original_paths": [
      "Crossroads (Feb 2007).rbxl"
    ],
    "collection": "root"
  },
  "discovery": {},
  "match": {
    "status": "unresolved",
    "confidence": "none",
    "reviewed": false
  },
  "preferred": false
}
