{
  "schema_version": 1,
  "id": "nla_633b162e7ecdf52e9f4ac5b8bbae5003",
  "title": "Cottonridge Inn",
  "snapshot": {},
  "blob": {
    "sha256": "b145e181adbafab484cf6120bd32880a03c291ce9839eb2d544ecd43c23d270d",
    "path": "levels/sha256/b1/b145e181adbafab484cf6120bd32880a03c291ce9839eb2d544ecd43c23d270d.rbxlx",
    "format": "xml",
    "size_bytes": 5536093,
    "download_url": "https://raw.githubusercontent.com/Builder-Pals/native-level-archive/main/levels/sha256/b1/b145e181adbafab484cf6120bd32880a03c291ce9839eb2d544ecd43c23d270d.rbxlx"
  },
  "validation": {
    "status": "valid"
  },
  "provenance": {
    "original_paths": [
      "Cottonridge Inn.rbxl"
    ],
    "collection": "root"
  },
  "discovery": {},
  "match": {
    "status": "unresolved",
    "confidence": "none",
    "reviewed": false
  },
  "preferred": false
}
