{
  "schema_version": 1,
  "id": "nla_9e4f05af76b5c21ba1bca1db7d20868e",
  "title": "#5 - Work at a Pizza Place (2020 version)",
  "snapshot": {
    "label": "2020 version",
    "date": "2020-01-01",
    "precision": "year"
  },
  "blob": {
    "sha256": "af0d7f912f1286c82037e2c0543381f61ea875a2f8e30b38a94b2f4436204fe2",
    "path": "levels/sha256/af/af0d7f912f1286c82037e2c0543381f61ea875a2f8e30b38a94b2f4436204fe2.rbxl",
    "format": "binary",
    "size_bytes": 5508836,
    "download_url": "https://raw.githubusercontent.com/Builder-Pals/native-level-archive/main/levels/sha256/af/af0d7f912f1286c82037e2c0543381f61ea875a2f8e30b38a94b2f4436204fe2.rbxl"
  },
  "validation": {
    "status": "valid"
  },
  "provenance": {
    "original_paths": [
      "#5 - Work at a Pizza Place (2020 version).rbxl"
    ],
    "collection": "root"
  },
  "discovery": {},
  "source": {
    "root_place_id": 192800,
    "universe_id": 47545,
    "name": "🍕Work at a Pizza Place",
    "roblox_url": "https://www.roblox.com/games/192800",
    "description": "🤝Work as a team to fulfill food orders.\n🏠Use your work earnings to upgrade your house and buy furniture.\n\nDon't forget to 👍 and ⭐! It really helps!",
    "creator": {
      "id": 82471,
      "name": "Dued1",
      "type": "User"
    },
    "created_at": "2008-03-28T18:12:42.6Z",
    "updated_at": "2026-07-09T05:56:44.343Z"
  },
  "match": {
    "status": "verified",
    "confidence": "high",
    "reviewed": true,
    "evidence": [
      {
        "kind": "catalog_record",
        "value": "nla_10578d7d191e2983353c07f2f8261ed1",
        "detail": "curated Work at a Pizza Place record resolves to universe 47545 and root place 192800"
      }
    ]
  },
  "preferred": false
}
