{
  "schema_version": 1,
  "id": "nla_b60b25c78b5d5ecb47fb776804543f9d",
  "title": "Winter rocket arena",
  "snapshot": {},
  "blob": {
    "sha256": "5e8f74d8928798565e74ff6035659174057c5da7bc333064ee76135a6f468f06",
    "path": "levels/sha256/5e/5e8f74d8928798565e74ff6035659174057c5da7bc333064ee76135a6f468f06.rbxlx",
    "format": "xml",
    "size_bytes": 359660,
    "download_url": "https://raw.githubusercontent.com/Builder-Pals/native-level-archive/main/levels/sha256/5e/5e8f74d8928798565e74ff6035659174057c5da7bc333064ee76135a6f468f06.rbxlx"
  },
  "validation": {
    "status": "valid"
  },
  "provenance": {
    "original_paths": [
      "Winter rocket arena.rbxl"
    ],
    "collection": "root"
  },
  "discovery": {},
  "match": {
    "status": "unresolved",
    "confidence": "none",
    "reviewed": false
  },
  "preferred": false
}
