{
  "schema_version": 1,
  "id": "nla_28607ef8a1e00a6588a4e51bc9112b6e",
  "title": "Brickbattle Waterfall Fortress",
  "snapshot": {},
  "blob": {
    "sha256": "1f19aff65a93cde0af2e92adbe97bcf775259548a2d50e8628c30548b2021dac",
    "path": "levels/sha256/1f/1f19aff65a93cde0af2e92adbe97bcf775259548a2d50e8628c30548b2021dac.rbxlx",
    "format": "xml",
    "size_bytes": 5302091,
    "download_url": "https://raw.githubusercontent.com/Builder-Pals/native-level-archive/main/levels/sha256/1f/1f19aff65a93cde0af2e92adbe97bcf775259548a2d50e8628c30548b2021dac.rbxlx"
  },
  "validation": {
    "status": "valid"
  },
  "provenance": {
    "original_paths": [
      "Brickbattle Waterfall Fortress.rbxl"
    ],
    "collection": "root"
  },
  "discovery": {},
  "match": {
    "status": "unresolved",
    "confidence": "none",
    "reviewed": false
  },
  "preferred": false
}
