{
  "schema_version": 1,
  "id": "nla_1895d5e9728b2db6c2e85ae787a44808",
  "title": "Heli-Wars Desert Attack",
  "snapshot": {},
  "blob": {
    "sha256": "d8b7b4e251a577c67fe14e8ec5d5ddafa4449eb23b7e42d9c7c25d43f33fbf29",
    "path": "levels/sha256/d8/d8b7b4e251a577c67fe14e8ec5d5ddafa4449eb23b7e42d9c7c25d43f33fbf29.rbxlx",
    "format": "xml",
    "size_bytes": 2403321,
    "download_url": "https://raw.githubusercontent.com/Builder-Pals/native-level-archive/main/levels/sha256/d8/d8b7b4e251a577c67fe14e8ec5d5ddafa4449eb23b7e42d9c7c25d43f33fbf29.rbxlx"
  },
  "validation": {
    "status": "valid"
  },
  "provenance": {
    "original_paths": [
      "Heli-Wars Desert Attack.rbxl"
    ],
    "collection": "root"
  },
  "discovery": {},
  "match": {
    "status": "unresolved",
    "confidence": "none",
    "reviewed": false
  },
  "preferred": false
}
