{
  "schema_version": 1,
  "id": "nla_35667c6ceeaf360b68590580e8f2e281",
  "title": "Beat-the-Scammers",
  "snapshot": {},
  "blob": {
    "sha256": "0877a1fd1667222598fd53ca0ef212c839c6f8b3de3e83af5c6d0da116647839",
    "path": "levels/sha256/08/0877a1fd1667222598fd53ca0ef212c839c6f8b3de3e83af5c6d0da116647839.rbxl",
    "format": "binary",
    "size_bytes": 446382,
    "download_url": "https://raw.githubusercontent.com/Builder-Pals/native-level-archive/main/levels/sha256/08/0877a1fd1667222598fd53ca0ef212c839c6f8b3de3e83af5c6d0da116647839.rbxl"
  },
  "validation": {
    "status": "valid"
  },
  "provenance": {
    "original_paths": [
      "Beat-the-Scammers.rbxl"
    ],
    "collection": "root"
  },
  "discovery": {},
  "match": {
    "status": "unresolved",
    "confidence": "none",
    "reviewed": false
  },
  "preferred": false
}
