{
  "schema_version": 1,
  "id": "nla_ce33303dd9ce9ebe112c79ea6b6a99a7",
  "title": "Trick-or-Traitors (October 4th, 2014)",
  "snapshot": {
    "label": "October 4th, 2014",
    "date": "2014-10-04",
    "precision": "day"
  },
  "blob": {
    "sha256": "01024dee03b4e602dd014bb2548d3c4579c3bad63ad0f89ccc07e442f6d1d22d",
    "path": "levels/sha256/01/01024dee03b4e602dd014bb2548d3c4579c3bad63ad0f89ccc07e442f6d1d22d.rbxl",
    "format": "binary",
    "size_bytes": 4170649,
    "download_url": "https://raw.githubusercontent.com/Builder-Pals/native-level-archive/main/levels/sha256/01/01024dee03b4e602dd014bb2548d3c4579c3bad63ad0f89ccc07e442f6d1d22d.rbxl"
  },
  "validation": {
    "status": "valid"
  },
  "provenance": {
    "original_paths": [
      "Trick-or-Traitors (October 4th, 2014).rbxl"
    ],
    "collection": "root"
  },
  "discovery": {},
  "match": {
    "status": "unresolved",
    "confidence": "none",
    "reviewed": false
  },
  "preferred": false
}
